{
  "protocol_version": "codeattest.v0",
  "review_id": "review:synthetic-demo-001",
  "normalization_run_id": "normalization_run:synthetic-demo-no-findings",
  "normalization_status": "no_findings_produced",
  "created_at": "2026-07-21T00:05:00Z",
  "vendor_receipt_ref": "sha256:7d69283d2989cb314edfbd22681984017626132612ea2924e60048f763cbbff2",
  "evidence_bundle_id": "sha256:d95effee91d501c4c8d5056f65063644652052b4245c7e464c8942ff2fda97bb",
  "manifest_id": "sha256:8a3c1f94ede7de4e1b576aebe8c84afd8bc56290c852d3d737a22ff32420019b",
  "source_scanner_finding_set_ref": "sha256:cccccccccccccccccccccccccccccccccccccccccccccccccccccccccccccccc",
  "coverage_mode": "finding_context_snippets",
  "review_finding_drafts": [],
  "normalization_limitations": [
    "No findings were produced by the configured inputs; this does not prove absence of vulnerabilities.",
    "Configured inputs and coverage mode bound this statement to submitted scanner outputs only."
  ],
  "no_findings_statement": "No findings were produced by the configured inputs",
  "source_derived_class": "retained_review_artifact"
}
